{"authorized":false,"automatic_apply":false,"base_commit":"2019f0bea57df857b39e0e06d3b827fcf07c72c7","before_sha256":"0d66b7a4d40ed25e61e7895b1fbc5e7d57a9fd8dba8f6f9e5460c6d5409f97cc","created_at":"2026-09-03T21:35:28Z","decision":"do-not-apply","desired_package_observer_sha256":"e67e1d05149a35476ab8449f8d369d7f9921fd4474b0508064aaa7c1ef603070","desired_plan_transport_sha256":"7210d4cbf51da161db9946ff95e407ef55775646c9fac4bd1110455bab481522","desired_sudo_rule_sha256":"40d2e94a05d23d48e3e368b2b059260c08e94ced8815cd2ac23635c869d05166","expires_at":"2026-09-03T22:05:28Z","format":"home-lab-proxmox-package-observer-capability-plan-evidence-v1","live_locks":[],"plan_sha256":"cb369c6206a619eed59b1690914a92ffad1594772b34e20259466cf83a493e0b","production_mutation_performed":false,"version":1}
